{
  "schema": "jackal-agent-profile-v1",
  "profile_id": "full",
  "description": "Complete v1.7.0 surface: all 34 tools declared by plugin/hermes/tools.json, in declaration order, for operator-driven interactive use where the human reads the status field. This profile deliberately exposes the weaker honest lanes (bounded, exact, checked, estimated) alongside the formal lane; each tool still reports its own status and the engine still refuses rather than downgrading, but an autonomous agent given this surface can choose a weaker lane without ever touching a verifier, which is why it is not the autonomous default. Membership here is byte-derived from tools.json and is verified to equal that set exactly, so adding a tool to the plugin without adding it here is a refusal, not a silent omission.",
  "tools": [
    "jackal_range_bound",
    "jackal_gaussian_integral",
    "jackal_integrate_bound_cert",
    "jackal_verify_receipt",
    "jackal_sqrt_rat_bound",
    "jackal_exp_rat_bound",
    "jackal_ln_rat_bound",
    "jackal_sin_rat_bound",
    "jackal_cos_rat_bound",
    "jackal_atan_rat_bound",
    "jackal_tanh_rat_bound",
    "jackal_exact",
    "jackal_evaluate",
    "jackal_diff",
    "jackal_integrate",
    "jackal_integrate_adaptive",
    "jackal_integrate_bound",
    "jackal_solve",
    "jackal_canon",
    "jackal_poly_canon",
    "jackal_poly_eq",
    "jackal_poly_gcd",
    "jackal_ratfunc_canon",
    "jackal_roots_isolate",
    "jackal_alg_sign",
    "jackal_alg_cmp",
    "jackal_xgcd",
    "jackal_mod_pow",
    "jackal_mod_inv",
    "jackal_crt",
    "jackal_divides",
    "jackal_prime_cert",
    "jackal_claim",
    "jackal_verify_bundle"
  ],
  "immutable": true,
  "profile_digest_sha256": "f90e6838c0facbafa89329462451e167fcb4a251d75d328c7a6f12ead2aa0c7a"
}
